{
  "objectType": "Task",
  "objectId": "TASK-0019",
  "state": "COMPLETED",
  "jobId": null,
  "issue": 85,
  "program": "GOVERNANCE",
  "milestone": null,
  "slice": null,
  "title": "Register P5-M01 implemented (Slice gate 8) + promote DEC-0016 canonical",
  "description": "",
  "priority": "NORMAL",
  "risk": "NORMAL",
  "owner": null,
  "dependencies": [],
  "scope": {
    "paths": [
      "docs/n8n-lego/milestones.json",
      "docs/n8n-lego/evidence/P5-M01-EVIDENCE.md",
      "docs/engineering-operations/workforce/decisions/DEC-0016.json",
      "tools/workforce/test/repo-invariants.test.mjs",
      ".ai/"
    ],
    "domains": [],
    "contracts": [],
    "generatedSurfaces": [],
    "vocabulary": [],
    "semanticSurfaces": [],
    "securitySurfaces": [],
    "governanceSurfaces": []
  },
  "constraints": {
    "forbiddenPaths": [],
    "forbiddenDomains": [],
    "forbiddenContracts": [],
    "securityBoundaries": [],
    "workspaceBoundary": "task-scoped"
  },
  "requirements": {
    "capabilities": [],
    "capacityClass": "NORMAL",
    "runnerClasses": [
      "ANY"
    ],
    "network": "NONE",
    "runnerRequired": false,
    "runnerType": null
  },
  "acceptance": {
    "criteria": [],
    "requiredEvidenceTypes": [],
    "requiredGates": []
  },
  "execution": {
    "mergeLane": "MANAGER",
    "rollbackClass": "SIMPLE",
    "activeLeaseId": null,
    "reservationIds": [],
    "decisionPending": false,
    "hold": false,
    "phase": "PHASE_A_REMOTE"
  },
  "branch": {
    "persistentBranch": null,
    "taskBranch": null,
    "baseSha": null
  },
  "current": {
    "headSha": null,
    "prNumber": null,
    "nextAction": null,
    "blocker": null,
    "handoffId": null,
    "reason": null,
    "supersededBy": null,
    "completedMainSha": "944d4fc51001f9ffd13a1c0ccfadd4165ea12aa9"
  },
  "history": {
    "reassignedCount": 0,
    "retryCount": 0,
    "recoveryCount": 0,
    "deferCount": 0,
    "ciRetryCount": 0,
    "reservationConflictCount": 0,
    "scopeCorrectionCount": 0
  },
  "runnerVerification": null,
  "schemaVersion": "1.0",
  "revision": 2,
  "createdAt": "2026-09-25T07:28:01Z",
  "updatedAt": "2026-09-25T07:38:12Z",
  "events": [
    "EVT-001100",
    "EVT-001120"
  ]
}
